<?xml version="1.0" encoding="UTF-8" standalone="no" ?>
<!DOCTYPE DeviceList SYSTEM "usbdmDeviceSchema.dtd"
[
<!ENTITY CFV2-default-flashProgram      SYSTEM "CFVx/ColdfireV2-default-flash-program.elf.S19">
<!ENTITY CFV2-default-flashScripts      SYSTEM "CFVx/ColdfireV2-default-flash-scripts.tcl">
<!ENTITY Custom-Devices                 SYSTEM "Custom/custom-cfvx.xml">
]>
<root version="4.9.5">
   <description>Coldfire V2,3,4 device characteristics v4.7.0 10/8/2011</description>
   <sharedInformation>
      <flashProgram id="default-CFV2-FlashProgram">
         &CFV2-default-flashProgram;
      </flashProgram>
      <tclScript id="default-CFV2-Scripts">
         &CFV2-default-flashScripts;
      </tclScript>
      <!-- CFV2 Unsecured value = backdoor[8],CFMPROT[4],CFMSACC[4],CFMDACC[4],CFMSEC[4] -->
      <securityInfo size="24" type="off" id="CFV2-default-security-off">
         0000000000000000 00000000 00000000 00000000 00000000
      </securityInfo>
      <!-- CFV2 Secured value = backdoor[8],CFMPROT[4],CFMSACC[4],CFMDACC[4],CFMSEC[4] -->
      <securityInfo size="24" type="on" id="CFV2-default-security-on">
         FFFFFFFFFFFFFFFF FFFFFFFF FFFFFFFF FFFFFFFF C0004AC8
      </securityInfo>
      <memory id="coldfire4K_Ram" type="ram">
         <memoryRange start="0x20000000" size="4K" />
      </memory>
      <memory id="coldfire8K_Ram" type="ram">
         <memoryRange start="0x20000000" size="4K" />
      </memory>
      <memory id="coldfire16K_Ram" type="ram">
         <memoryRange start="0x20000000" size="16K" />
      </memory>
      <memory id="coldfire32K_Ram" type="ram">
         <memoryRange start="0x20000000" size="32K" />
      </memory>
      <memory id="coldfire64K_Ram" type="ram">
         <memoryRange start="0x20000000" size="64K" />
      </memory>
      <memory id="coldfire64K_Flash" type="flash" registerAddress="0x401D0000" securityAddress="0x0400" alignment="4"
         sectorSize="2048">
         <flashProgramRef ref="default-CFV2-FlashProgram" />
         <securityInfoRef ref="CFV2-default-security-off" />
         <securityInfoRef ref="CFV2-default-security-on" />
         <memoryRange start="0x000000" size="64K" />
      </memory>
      <memory id="coldfire128K_Flash" type="flash" registerAddress="0x401D0000" securityAddress="0x0400" alignment="4"
         sectorSize="2048">
         <flashProgramRef ref="default-CFV2-FlashProgram" />
         <securityInfoRef ref="CFV2-default-security-off" />
         <securityInfoRef ref="CFV2-default-security-on" />
         <memoryRange start="0x000000" size="128K" />
      </memory>
      <memory id="coldfire256K_Flash" type="flash" registerAddress="0x401D0000" securityAddress="0x0400" alignment="4"
         sectorSize="2048">
         <flashProgramRef ref="default-CFV2-FlashProgram" />
         <securityInfoRef ref="CFV2-default-security-off" />
         <securityInfoRef ref="CFV2-default-security-on" />
         <memoryRange start="0x000000" size="256K" />
      </memory>
      <memory id="coldfire512K_Flash" type="flash" registerAddress="0x401D0000" securityAddress="0x0400" alignment="4"
         sectorSize="2048">
         <flashProgramRef ref="default-CFV2-FlashProgram" />
         <securityInfoRef ref="CFV2-default-security-off" />
         <securityInfoRef ref="CFV2-default-security-on" />
         <memoryRange start="0x000000" size="512K" />
      </memory>
   </sharedInformation>
   <deviceList>
      <device family="CFVx" name="_Default" isDefault="true">
         <clock type="External" registerAddress="0" />
         <memory type="ram">
            <memoryRange start="0x20000000" size="4K" />
         </memory>
         <memory type="flash" registerAddress="0x401D0000" securityAddress="0x0400" sectorSize="2048" alignment="4">
            <securityInfoRef ref="CFV2-default-security-off" />
            <securityInfoRef ref="CFV2-default-security-on" />
            <memoryRange start="0x000000" size="512K" />
         </memory>
         <sdidAddress value="0x4011000A" />
         <sdidMask value="0xFFC0" />
         <sdid value="0x0000" />
         <tclScriptRef ref="default-CFV2-Scripts" />
         <flashProgramRef ref="default-CFV2-FlashProgram" />
         <note>Default CFV1 Device</note>
      </device>
      &Custom-Devices;
      <device family="CFVx" name="MCF52221">
         <clock type="External" registerAddress="0" />
         <memoryRef ref="coldfire16K_Ram" />
         <memoryRef ref="coldfire128K_Flash" />
         <sdid value="0x1400" />
      </device>
      <device family="CFVx" name="MCF52223">
         <clock type="External" registerAddress="0" />
         <memoryRef ref="coldfire16K_Ram" />
         <memoryRef ref="coldfire128K_Flash" />
         <sdid value="0x14C0" />
      </device>
      <device family="CFVx" name="MCF52230">
         <clock type="External" registerAddress="0" />
         <memoryRef ref="coldfire32K_Ram" />
         <memoryRef ref="coldfire128K_Flash" />
         <sdid value="0x1200" />
      </device>
      <device family="CFVx" name="MCF52231">
         <clock type="External" registerAddress="0" />
         <memoryRef ref="coldfire32K_Ram" />
         <memoryRef ref="coldfire128K_Flash" />
         <sdid value="0x1240" />
      </device>
      <device family="CFVx" name="MCF52232">
         <clock type="External" registerAddress="0" />
         <memoryRef ref="coldfire32K_Ram" />
         <memoryRef ref="coldfire128K_Flash" />
         <sdid value="0x0000" />
      </device>
      <device family="CFVx" name="MCF52233">
         <clock type="External" registerAddress="0" />
         <memoryRef ref="coldfire32K_Ram" />
         <memoryRef ref="coldfire256K_Flash" />
         <sdid value="0x1280" />
      </device>
      <device family="CFVx" name="MCF52234">
         <clock type="External" registerAddress="0" />
         <memoryRef ref="coldfire32K_Ram" />
         <memoryRef ref="coldfire256K_Flash" />
         <sdid value="0x12C0" />
      </device>
      <device family="CFVx" name="MCF52235">
         <clock type="External" registerAddress="0" />
         <memoryRef ref="coldfire32K_Ram" />
         <memoryRef ref="coldfire256K_Flash" />
         <sdid value="0x1300" />
      </device>
      <device family="CFVx" name="MCF52236">
         <clock type="External" registerAddress="0" />
         <memoryRef ref="coldfire32K_Ram" />
         <memoryRef ref="coldfire256K_Flash" />
         <sdid value="0x1280" />
      </device>
      <device family="CFVx" name="MCF52210">
         <clock type="External" registerAddress="0" />
         <memoryRef ref="coldfire16K_Ram" />
         <memoryRef ref="coldfire64K_Flash" />
         <sdid value="0x0" />
      </device>
      <device family="CFVx" name="MCF52211">
         <clock type="External" registerAddress="0" />
         <memoryRef ref="coldfire16K_Ram" />
         <memoryRef ref="coldfire128K_Flash" />
         <sdid value="0x0" />
      </device>
      <device family="CFVx" name="MCF52212">
         <clock type="External" registerAddress="0" />
         <memoryRef ref="coldfire8K_Ram" />
         <memoryRef ref="coldfire64K_Flash" />
         <sdid value="0x0" />
      </device>
      <device family="CFVx" name="MCF52213">
         <clock type="External" registerAddress="0" />
         <memoryRef ref="coldfire8K_Ram" />
         <memoryRef ref="coldfire128K_Flash" />
         <sdid value="0x1580" />
      </device>
      <!--
         =======================================================================
      -->
      <device family="CFVx" name="MCF52259">
         <clock type="External" registerAddress="0" />
         <memoryRef ref="coldfire64K_Ram" />
         <memory type="io">
            <memoryRange size="1024M" start="0x40000000" />
         </memory>
         <memoryRef ref="coldfire512K_Flash" />
         <sdid value="0x2481" />
      </device>
   </deviceList>
</root>